Archivo;comercial;compañia;principio activo;patologia a tratar;Acronimo patologia;administracion;monoterapia;combinacion;medicamento en combinacion;forma_farmaceutica_simplificada;Aprobado/Denegado;seccion;Descripcion patologia;Descripcion;docs;fecha;historial;ema;FDA;FDA info;FDA fecha
ACUERDOS_CIPM_250.pdf;keytruda;Merck Sharp & Dohme B.V.;PEMBROLIZUMAB;linfoma;alk;segunda línea;True;False;;INYECTABLE PERFUSION;aprobado;nueva indicación; keytruda en monoterapia está indicado para el tratamiento del cáncer de pulmón no microcítico localmente avanzado o metastásico en adultos cuyos tumores expresen pd -l1 con una tps ≥ 1% y que hayan recibido al menos un tratamiento de quimioterapia previo.  l os pacientes con mutaciones tumorales positivas de egfr o alk deben haber recibido también terapia dirigida antes de recibir keytruda  linfoma de hodgkin clásico (lh keytruda en monoterapia está indicado para el tratamiento de pacientes adultos y pediátricos a partir de 3 años de edad con linfoma de hodgkin clásico en recaída o refractario, que no han respondido a un trasplante autólogo de progenitores hematopoyéticos (tap o después de al menos dos tratamientos previos cuando el taph no es una opción de tratamiento;"keytruda ® ................................ ................................ .... laboratorio medicamento formato cn precio € criterios para la financiación merck sharp dohme de españa sa keytruda 25 mg/ml concentrado para solucion para perfusio n 1 vial de 4 ml 712570 3.566 principio activo: l01ff02 - pembrolizumab indicación terapéutica autorizada: melanoma keytruda en monoterapia está indicado para el tratamiento en adultos y adolescentes a partir de 12 años de edad con melanoma avanzado (irresecable o metastásic . keytruda en monoterapia está indicado para el tratamiento adyuvante en adultos y adolescentes a partir de 12 años de edad con melanoma en estadio iib, iic o iii y que hayan sido sometidos a resección completa. cáncer de pulmón no microcítico (cpn keytruda, en combinación con quimioterapia basada en platino como tratamiento neoadyuvante y luego continuado en monoterapia como tratamiento adyuvante, está indicado para el tratamiento del cáncer de pulmón no microcítico resecable con alto riesgo de reci diva en adultos. 
keytruda en monoterapia está indicado para el tratamiento adyuvante en adultos con cáncer de pulmón no microcítico con alto riesgo de recidiva después de resección completa y quimioterapia basada en platino. keytruda en monoterapia está indicado para el tratamiento de primera línea del cáncer de pulmón no microcítico metastásico en adultos cuyos tumores expresen pd -l1 con una proporción de marcador tumoral (tps, por sus siglas en inglé ≥ 50% sin mutaciones t umorales positivas de egfr o alk. keytruda, en combinación con pemetrexed y quimioterapia basada en platino está indicado para el tratamiento de primera línea del cáncer de pulmón no microcítico no escamoso metastásico en adultos cuyos tumores no tengan mutaciones tumorales positivas de eg fr o alk. keytruda, en combinación con carboplatino y paclitaxel o nab -paclitaxel, está indicado para el tratamiento de primera línea del cáncer de pulmón no microcítico escamoso metastásico en adultos. keytruda en monoterapia está indicado para el tratamiento del cáncer de pulmón no microcítico localmente avanzado o metastásico en adultos cuyos tumores expresen pd -l1 con una tps ≥ 1% y que hayan recibido al menos un tratamiento de quimioterapia previo. l os pacientes con mutaciones tumorales positivas de egfr o alk deben haber recibido también terapia dirigida antes de recibir keytruda. linfoma de hodgkin clásico (lh keytruda en monoterapia está indicado para el tratamiento de pacientes adultos y pediátricos a partir de 3 años de edad con linfoma de hodgkin clásico en recaída o refractario, que no han respondido a un trasplante autólogo de progenitores hematopoyéticos (tap o después de al menos dos tratamientos previos cuando el taph no es una opción de tratamiento. carcinoma urotelial keytruda, en combinación con enfortumab vedotina, está indicado para el tratamiento de primera línea del carcinoma urotelial irresecable o metastásico en adultos. keytruda en monoterapia está indicado para el tratamiento del carcinoma urotelial localmente avanzado o metastásico en adultos que hayan recibido quimioterapia previa basada en platino. keytruda en monoterapia está indicado para el tratamiento del carcinoma urotelial localmente avanzado o metastásico en adultos que no son candidatos a quimioterapia basada en cisplatino y cuyos tumores expresen pd -l1 con una puntuación positiva combinada ( cps, por sus siglas en inglé ≥ 10. carcinoma de células escamosas de cabeza y cuello (ccec keytruda, en monoterapia o en combinación con quimioterapia basada en platino y 5 -fluorouracilo (5-f , está indicado para el tratamiento de primera línea del carcinoma de células escamosas de cabeza y cuello metastásico o recurrente irresecable en adultos cuyos tumores expresen pd -l1 con una cps ≥ 1. keytruda en monoterapia está indicado para el tratamiento del carcinoma de células escamosas de cabeza y cuello recurrente o metastásico en adultos cuyos tumores expresen pd -l1 con una tps ≥ 50% y que progresen durante o después de quimioterapia basada en platino. 
carcinoma de células renales (cc keytruda, en combinación con axitinib, está indicado para el tratamiento de primera línea del carcinoma de células renales avanzado en adultos. keytruda, en combinación con lenvatinib, está indicado para el tratamiento de primera línea del carcinoma de células renales avanzado en adultos. keytruda en monoterapia está indicado para el tratamiento adyuvante en adultos con carcinoma de células renales con aumento del riesgo de recidiva después de nefrectomía, o después de nefrectomía y resección de las lesiones metastásicas. tipos de cáncer con inestabilidad de microsatélites alta (msi -h, por sus siglas en inglé o con deficiencia del sistema de reparación de apareamientos erróneos (dmmr, por sus siglas en inglé cáncer colorrectal keytruda en monoterapia está indicadoen adultos con cáncer colorrectal con msi -h o dmmr en los siguientes contextos: - tratamiento de primera línea del cáncer colorrectal metastásico; - tratamiento del cáncer colorrectal irresecable o metastásico después de quimioterapia de combinación previa basada en fluoropirimidina. tipos de cáncer no colorrectal keytruda en monoterapia está indicado para el tratamiento de los siguientes tumores con msi -h o dmmr en adultos con: - cáncer de endometrio avanzado o recurrente que ha progresado durante o después de un tratamiento previo basado en platino, en cualquier contexto, y que no son candidatas a cirugía curativa o radioterapia; - cáncer gástrico, de intestino delgado o biliar, irresecable o metastásico que ha progresado durante o después de al menos un tratamiento previo. carcinoma de esófago keytruda, en combinación con quimioterapia basada en platino y fluoropirimidina, está indicado para el tratamiento de primera línea del carcinoma de esófago localmente avanzado irresecable o metastásico en adultos cuyos tumores expresen pd -l1 con una cps ≥ 10. cáncer de mama triple negativo (cmt keytruda, en combinación con quimioterapia como tratamiento neoadyuvante y luego continuado en monoterapia como tratamiento adyuvante después de la cirugía, está indicado para el tratamiento en adultos con cáncer de mama triple negativo localmente avanzado o en estadio temprano con riesgo alto de recidiva. keytruda, en combinación con quimioterapia, está indicado para el tratamiento del cáncer de mama triple negativo localmente recurrente irresecable o metastásico en adultos cuyos tumores expresen 
pd-l1 con una cps ≥ 10 y que no hayan recibido quimioterapia previa para la enfermedad metastásica. cáncer de endometrio (c keytruda, en combinación con lenvatinib, está indicado para el tratamiento del cáncer de endometrio avanzado o recurrente en mujeres adultas con progresión de la enfermedad durante o después de un tratamiento previo basado en platino, en cualquier contexto , y que no son candidatas a cirugía curativa o radioterapia. cáncer de cuello uterino keytruda, en combinación con quimioterapia con o sin bevacizumab, está indicado para el tratamiento del cáncer de cuello uterino persistente, recurrente o metastásico en mujeres adultas cuyos tumores expresen pd -l1 con una cps ≥ 1. adenocarcinoma gástrico o de la unión gastroesofágica (ug keytruda, en combinación con trastuzumab, y quimioterapia basada en fluoropirimidina y platino, está indicado para el tratamiento de primera línea del adenocarcinoma gástrico o de la unión gastroesofágica her -2 positivo localmente avanzado irresecable o metastásico en adultos cuyos tumores expresen pd -l1 con una cps ≥ 1. keytruda, en combinación con quimioterapia basada en fluoropirimidina y platino, está indicado para el tratamiento de primera línea del adenocarcinoma gástrico o de la unión gastroesofágica her -
2 negativo localmente avanzado irresecable o metastásico en ad ultos cuyos tumores expresen pd -
l1 con una cps ≥ 1. carcinoma de vías biliares (cv keytruda, en combinación con gemcitabina y cisplatino, está indicado para el tratamiento de primera línea en adultos con carcinoma de vías biliares localmente avanzado irresecable o metastásico. indicaciones terapéuticas financiadas: keytruda en monoterapia está indicado para el tratamiento del cpnm localmente avanzado o metastásico en adultos cuyos tumores expresen pd -l1 con una tps ≥1% y que hayan recibido al menos un tratamiento de quimioterapia previo. los pacientes con mutaciones tumorales positivas de egfr o alk deben haber recibido también terapia dirigida antes de recibir keytruda. keytruda en monoterapia está indicado para el tratamiento de primera línea del cáncer de pulmón no microcítico (cpn metastásico en adultos cuyos tumores expresen pd -l1 con una proporción de marcador tumoral (tps, por sus siglas en inglé ≥50% sin mutaci ones tumorales positivas de egfr o alk. keytruda en monoterapia está indicado para el tratamiento del melanoma avanzado (irresecable o metastásic en adultos. keytruda, en monoterapia o en combinación con quimioterapia basada en platino y 5 - fluorouracilo (5-f , está indicado para el tratamiento de primera línea del carcinoma de células escamosas de 
cabeza y cuello (ccec metastásico o recurrente irresecable en adultos cuyos tumores expresen pd-l1 con una cps ≥ 1. se restringe la financiación: - en monoterapia a aquellos pacientes no candidatos a la quimioterapia estándar (régimen extrem - en combinación con quimioterapia basada en platinos y 5 -fu sólo en el caso de pacientes que presenten síntomas y/o enfermedad de rápida evolución o alta carga tumoral que haga prever un desenlace fatal en 6 meses keytruda, en combinación con pemetrexed y quimioterapia basada en platino está indicado para el tratamiento de primera línea del cpnm no escamoso metastásico en adultos cuyos tumores no tengan mutaciones tumorales positivas de egfr o alk. se restringe la financiación a pacientes con expresión pd-l1<50%, negativa o no posible de realizar, en los que la terapia actual es la quimioterapia. keytruda, en combinación con carboplatino y paclitaxel o nab -paclitaxel, está indicado para el tratamiento de primera línea del cpnm escamoso metastásico en adultos. se limita su utilización en pacientes con cáncer de pulmón no microcítico metastásico escamoso con expresión pd -l1<50%, negativa o no posible de realizar. keytruda, en combinación con quimioterapia, está indicado para el tratamiento del cáncer de mama triple negativo localmente recurrente irresecable o metastásico en adultos cuyos tumores expresen pd-l1 con una cps ≥ 10 y que no hayan recibido quimioterapia previa para la enfermedad metastásica. keytruda en monoterapia está indicado para el tratamiento de primera línea del cáncer colorrectal metastásico con inestabilidad de microsatélites alta (msi -h, por sus siglas en inglé o con deficiencia del sistema de reparación de apareamientos erróneos ( dmmr, por sus siglas en inglé en adultos. keytruda en monoterapia está indicado para el tratamiento adyuvante en adultos con carcinoma de células renales con aumento del riesgo de recidiva después de nefrectomía, o después de nefrectomía y resección de las lesiones metastásicas. se restringe la financiación a pacientes con carcinoma renal de células claras: - con riesgo intermedio/alto y alto tras nefrectomía y - en los pacientes m1 ned, tras la nefrectomía y la resección de las lesiones metastásicas keytruda en monoterapia está indicado para el tratamiento en adultos y adolescentes a partir de 12 años de edad con melanoma avanzado (irresecable o metastásic . keytruda en monoterapia está indicado para el tratamiento adyuvante en adultos y adolescentes a partir de 12 años de edad con melanoma en estadio iib, iic o iii y que hayan sido sometidos a resección completa. se restringe la financiación a pacientes con melanoma en estadios iib, iic, iiic o iiid y que hayan sido sometidos a resección completa keytruda en monoterapia está indicado para el tratamiento de los tumores con msi -h o dmmr en adultos con cáncer de endometrio avanzado o recurrente que ha progresado durante o después de un tratamiento previo basado en platino, en cualquier contexto, y que no son candidatas a cirugía curativa o radioterapia. keytruda en monoterapia está indicado para el tratamiento de los tumores con msi -h o dmmr en adultos con cáncer gástrico, de intestino delgado o biliar, irresecable o metastásico que ha progresado durante o después de al menos un tratamiento previo. 
keytruda en monoterapia está indicado para el tratamiento de los tumores con msi -h o dmmr en adultos con cáncer colorrectal irresecable o metastásico después de quimioterapia de combinación previa basada en fluoropirimidina. keytruda, en combinación con lenvatinib, está indicado para el tratamiento del cáncer de endometrio avanzado o recurrente en mujeres adultas con progresión de la enfermedad durante o después de un tratamiento previo basado en platino, en cualquier contexto , y que no son candidatas a cirugía curativa o radioterapia. keytruda, en combinación con quimioterapia basada en platino y fluoropirimidina, está indicado para el tratamiento de primera línea del carcinoma de esófago o adenocarcinoma de la unión gastroesofágica her -2 negativo localmente avanzado irresecable o metas tásico, en adultos cuyos tumores expresen pd -l1 con una cps ≥ 10. keytruda, en combinación con quimioterapia con o sin bevacizumab, está indicado para el tratamiento del cáncer de cuello uterino persistente, recurrente o metastásico en mujeres adultas cuyos tumores expresen pd -l1 con una cps ≥ 1. keytruda, en combinación con quimioterapia como tratamiento neoadyuvante y luego continuado en monoterapia como tratamiento adyuvante después de la cirugía, está indicado para el tratamiento en adultos con cáncer de mama triple negativo localmente avanzado o en estadio temprano con riesgo alto de recidiva indicaciones objeto de estos expedientes: keytruda, en combinación con gemcitabina y cisplatino, está indicado para el tratamiento de primera línea en adultos con carcinoma de vías biliares localmente avanzado irresecable o metastásico keytruda, en combinación con quimioterapia basada en fluoropirimidina y platino, está indicado para el tratamiento de primera línea del adenocarcinoma gástrico o de la unión gastroesofágica her -
2 negativo localmente avanzado irresecable o metastásico en ad ultos cuyos tumores expresen pd -
l1 con una cps ≥ 1 condiciones de prescripción y dispensación: con receta. uso hospitalario. con respecto a este medicamento, la comisión acuerda proponer a la dirección general la inclusión en la prestación farmacéutica de las nuevas indicaciones objeto de estos expedientes, en los siguientes términos: - keytruda, en combinación con gemcitabina y cisplatino, está indicado para el tratamiento de primera línea en adultos con carcinoma de vías biliares localmente avanzado irresecable o metastásico. - keytruda, en combinación con quimioterapia basada en fluoropirimidina y platino, está indicado para el tratamiento de primera línea del adenocarcinoma gástrico o de la unión gastroesofágica her -2 negativo localmente avanzado irresecable o metastásico en ad ultos cuyos tumores expresen pd -l1 con una cps ≥ 1 restringida a pacientes cuyos tumores expresen pd -l1 con una cps ≥ 10. 
asimismo, acuerda: • mantener el precio del medicamento citado, que aparece relacionado en la tabla anterior. • el seguimiento de los suministros se realizará mediante el proceso informático seguimed y/o aquel otro del que se disponga. el laboratorio estará obligado a registrarse en dicha aplicación y a comunicar con periodicidad mensual la oportuna información respecto a los suministros realizados del medicamento al sns.";https://cima.aemps.es/cima/pdfs/p/1151024002/P_1151024002.pdf;26/09/2024;[(Timestamp('2023-10-23 00:00:00'), 'aprobado'), (Timestamp('2023-09-20 00:00:00'), 'aprobado'), (Timestamp('2022-10-27 00:00:00'), 'denegado'), (Timestamp('2022-10-27 00:00:00'), 'aprobado')];True;False;;
